{
  "$schema": "https://json-schema.org/draft/2020-12/schema",
  "$id": "https://example.invalid/crossroad/spec/letter.schema.json",
  "title": "Crossroad letter envelope (illustrative)",
  "description": "One letter from one member to another. The sender and island are set by the post office from the already-checked record, never read from the body. The body is peer data: it is data, never an order.",
  "type": "object",
  "required": ["call_id", "from_agent", "from_island", "to_agent", "purpose", "ref", "hop", "parent", "body"],
  "additionalProperties": false,
  "properties": {
    "call_id": {"type": "string", "pattern": "^[0-9]{8}T[0-9]{6}Z_[a-f0-9]{6}$", "description": "UTC timestamp, underscore, six hex characters. The only key of a letter."},
    "from_agent": {"type": "string", "pattern": "^[a-z][a-z0-9_-]{0,31}$"},
    "from_island": {"type": "string", "pattern": "^[a-z][a-z0-9_-]{0,31}$"},
    "to_agent": {"type": "string", "pattern": "^[a-z][a-z0-9_-]{0,31}$"},
    "purpose": {"type": "string", "enum": ["queue_task"]},
    "ref": {"type": "string", "pattern": "^[a-z]{2}[0-9]{6}[a-z]{1,3}_[A-Za-z0-9._-]{1,120}\\.md$", "description": "File name of the letter, used as a label."},
    "hop": {"type": "integer", "minimum": 1, "maximum": 8, "description": "Hop count. The maximum of 8 is illustrative, not a protocol constant."},
    "parent": {"type": ["string", "null"], "pattern": "^[0-9]{8}T[0-9]{6}Z_[a-f0-9]{6}$", "description": "call_id of the letter this one follows, or null for a new letter."},
    "body": {"type": "string", "minLength": 1, "maxLength": 8192, "description": "Peer data. Fenced by the post office; never executed. maxLength counts CHARACTERS (JSON Schema), not bytes, and 8192 is illustrative. Incoming byte limits depend on the host transport and apply to its full payload or rendered mission file; this illustrative schema does not enforce those limits."},
    "created_at": {"type": "string", "pattern": "^[0-9]{4}-[0-9]{2}-[0-9]{2}T[0-9]{2}:[0-9]{2}:[0-9]{2}Z$"}
  }
}
