{
  "call_id": "20261016T020000Z_a1b2c3",
  "from_agent": "agent-a",
  "from_island": "pc1",
  "to_agent": "agent-b",
  "purpose": "queue_task",
  "ref": "xx261016a_Letter_Test.md",
  "hop": 1,
  "parent": null,
  "body": "Please compare options A and B and answer in two lines.",
  "created_at": "2026-10-16T02:00:00Z"
}
